{
  "schema_version": "0.2.0",
  "request_id": "request.de.vowel-quantity.001",
  "dlc_ref": "dlc.de.fsi-construction",
  "session_ref": "session.de.001",
  "language": "de-DE",
  "modality": ["text"],
  "constraints": {
    "length": {
      "min_units": 3,
      "max_units": 8,
      "unit": "sentence"
    },
    "safety": {
      "content_policy_ref": "policy.content.platform-default"
    }
  },
  "claims_to_cover": [
    "dlc.de.fsi-construction:claim/vowel_quantity"
  ],
  "randomness": "allowed",
  "allowed_sources": ["stored", "generated_instructed"],
  "persistence": "ephemeral_only"
}
